{
  "$schema": "https://json-schema.org/draft/2020-12/schema",
  "$id": "https://smplwise.local/contracts/plan_geometry.v2.schema.json",
  "title": "SMPLWISE plan geometry document v2 (Plan Studio, T084 / T085, CR-003; 2.1 window walls; 2.2 Plan Studio 6)",
  "description": "The structure layer of one plan version: walls, openings, labels, levels, objects from the library, groups, connectors and lighting circuits. Coordinates are normalized 0..1 to the plan version image (origin top-left), points are [x, y]; sizes are metres; the server owns plan_version_id, floor_id, source, dimensions and transform, recomputes circuit power and the connectors derived from objects that connect levels, and refreshes the position of an object bound to an anchor.",
  "type": "object",
  "required": ["schema_version", "plan_version_id", "floor_id", "source", "dimensions", "transform", "levels", "walls", "openings", "rooms", "objects", "circuits", "connectors", "labels", "groups", "uncertain_regions", "uncertainty", "meta"],
  "properties": {
    "schema_version": {"enum": ["2.0", "2.1", "2.2"], "description": "2.2 = the document carries a Plan Studio 6 field (CR-029 S0: material_id / floor_material_id / ceiling_material_id, a room ceiling flag, a window tint, a lamp light, north_deg, walk_positions); else 2.1 = a curved wall (a wall with bulges) or a window wall (a wall of kind glass or a glazing block); every other document stays 2.0. A reader refuses a version it does not know."},
    "plan_version_id": {"type": "string"},
    "floor_id": {"type": "string"},
    "source": {"type": "object", "required": ["sha256", "page"], "properties": {"sha256": {"type": "string", "pattern": "^[0-9a-f]{64}$"}, "file_name": {"type": "string"}, "mime": {"type": "string"}, "page": {"type": "integer", "minimum": 1}}},
    "dimensions": {"type": "object", "required": ["width_px", "height_px", "scale_m_per_px", "calibration"], "properties": {"width_px": {"type": "integer", "minimum": 1, "maximum": 100000}, "height_px": {"type": "integer", "minimum": 1, "maximum": 100000}, "scale_m_per_px": {"type": ["number", "null"], "exclusiveMinimum": 0}, "calibration": {"$ref": "#/$defs/calibration"}}},
    "transform": {"type": "object", "required": ["rotation"], "properties": {"rotation": {"enum": [0, 90, 180, 270]}, "crop": {"type": ["object", "null"]}}},
    "levels": {"type": "array", "minItems": 1, "maxItems": 20, "items": {"$ref": "#/$defs/level"}},
    "walls": {"type": "array", "maxItems": 2000, "items": {"$ref": "#/$defs/wall"}},
    "openings": {"type": "array", "maxItems": 4000, "items": {"$ref": "#/$defs/opening"}},
    "rooms": {"type": "array", "maxItems": 500, "items": {"$ref": "#/$defs/room"}},
    "objects": {"type": "array", "maxItems": 5000, "items": {"$ref": "#/$defs/object"}},
    "circuits": {"type": "array", "maxItems": 500, "items": {"$ref": "#/$defs/circuit"}},
    "connectors": {"type": "array", "maxItems": 200, "items": {"$ref": "#/$defs/connector"}},
    "labels": {"type": "array", "maxItems": 1000, "items": {"$ref": "#/$defs/label"}},
    "groups": {"type": "array", "maxItems": 500, "items": {"$ref": "#/$defs/group"}},
    "uncertain_regions": {"type": "array", "maxItems": 200, "items": {"$ref": "#/$defs/item"}},
    "uncertainty": {"type": "object", "required": ["overall", "notes"], "properties": {"overall": {"$ref": "#/$defs/unit"}, "notes": {"type": "array", "items": {"type": "string"}}}},
    "meta": {"type": "object"},
    "floor_height_m": {"type": "number", "minimum": 2.2, "maximum": 12, "description": "The floor's height, floor to floor (default 3.0): what stairs to another floor rise through."},
    "north_deg": {"type": "number", "minimum": 0, "exclusiveMaximum": 360, "description": "Document 2.2: the bearing of north on the plan, clockwise from plan up (absent = 0, plan up is north). The sun direction of the realistic level. At the top level because the server owns transform."},
    "walk_positions": {"type": "array", "maxItems": 50, "items": {"$ref": "#/$defs/walk_position"}, "description": "Document 2.2: the saved eye-level walk viewpoints (absent = none); at most one is_default."}
  },
  "$defs": {
    "unit": {"type": "number", "minimum": 0, "maximum": 1},
    "point": {"type": "array", "prefixItems": [{"$ref": "#/$defs/unit"}, {"$ref": "#/$defs/unit"}], "minItems": 2, "maxItems": 2},
    "id": {"type": "string", "minLength": 1, "maxLength": 64},
    "external_ids": {"type": "object", "additionalProperties": {"type": "string"}},
    "tags": {"type": "array", "maxItems": 20, "items": {"type": "string", "minLength": 1, "maxLength": 40}},
    "source": {"enum": ["manual", "auto", "imported"]},
    "anchor_ref": {"type": ["object", "null"], "required": ["resource_type", "resource_id"], "properties": {"resource_type": {"enum": ["camera", "ha_entity"]}, "resource_id": {"type": "string", "minLength": 1}}},
    "calibration": {"type": "object", "required": ["status"], "properties": {"status": {"enum": ["measured", "estimated", "missing"]}, "method": {"enum": ["two_point", "dxf_units", "door_width", "manual", "carried", null]}, "pairs": {"type": "array", "items": {"type": "object", "required": ["a", "b", "metres"], "properties": {"a": {"$ref": "#/$defs/point"}, "b": {"$ref": "#/$defs/point"}, "metres": {"type": "number", "exclusiveMinimum": 0}}}}, "residual_pct": {"type": ["number", "null"]}, "reason": {"type": ["string", "null"]}}},
    "size": {"type": "object", "required": ["w_m", "d_m", "h_m"], "properties": {"w_m": {"type": "number", "minimum": 0.05, "maximum": 100}, "d_m": {"type": "number", "minimum": 0.05, "maximum": 100}, "h_m": {"type": "number", "minimum": 0.05, "maximum": 100}}},
    "level": {"type": "object", "required": ["id", "name", "elevation_m", "ceiling_height_m", "is_default"], "properties": {"id": {"$ref": "#/$defs/id"}, "name": {"type": "string", "minLength": 1}, "elevation_m": {"type": "number", "minimum": -50, "maximum": 500}, "ceiling_height_m": {"type": "number", "exclusiveMinimum": 0, "maximum": 50}, "is_default": {"type": "boolean"}, "external_ids": {"$ref": "#/$defs/external_ids"}, "floor_material_id": {"$ref": "#/$defs/material_id"}, "ceiling_material_id": {"$ref": "#/$defs/material_id"}}},
    "wall": {"type": "object", "required": ["id", "level_id", "polyline", "thickness_m", "kind", "confidence", "source"], "properties": {"id": {"$ref": "#/$defs/id"}, "level_id": {"type": "string"}, "polyline": {"type": "array", "minItems": 2, "items": {"$ref": "#/$defs/point"}}, "bulges": {"type": "array", "items": {"type": "number", "minimum": -4, "maximum": 4}, "description": "curved walls (2.1): one DXF-style bulge per polyline segment, tan(theta/4) in plan pixels, positive = clockwise on screen"}, "thickness_m": {"type": "number", "exclusiveMinimum": 0, "maximum": 3}, "height_m": {"type": ["number", "null"]}, "base_z_m": {"type": "number"}, "kind": {"enum": ["exterior", "interior", "partition", "railing", "low", "glass"]}, "confidence": {"$ref": "#/$defs/unit"}, "source": {"$ref": "#/$defs/source"}, "locked": {"type": "boolean"}, "external_ids": {"$ref": "#/$defs/external_ids"}, "tags": {"$ref": "#/$defs/tags"}, "glazing": {"$ref": "#/$defs/glazing"}, "material_id": {"$ref": "#/$defs/material_id"}}},
    "glazing": {"type": "object", "description": "Document 2.1: the glazing of a window wall (kind glass); absent = the defaults. The wall's thickness is the frame depth, its height and base as for any wall. Panels are equal divisions of the wall's path length: panel_count when set, else round(length / panel_width_m).", "properties": {"panel_width_m": {"type": "number", "minimum": 0.2, "maximum": 6}, "panel_count": {"type": ["integer", "null"], "minimum": 1, "maximum": 200}, "mullion_m": {"type": "number", "minimum": 0.01, "maximum": 0.5}, "sill_m": {"type": "number", "minimum": 0, "maximum": 10}, "glazed_height_m": {"type": ["number", "null"], "minimum": 0.2, "maximum": 50}, "tint": {"enum": ["clear", "tinted", "frosted", "reflective"]}, "opacity": {"type": "number", "minimum": 0.05, "maximum": 0.95}, "operable": {"type": "array", "maxItems": 200, "items": {"type": "object", "required": ["panel", "operation"], "properties": {"panel": {"type": "integer", "minimum": 0, "maximum": 199}, "operation": {"enum": ["casement_left", "casement_right", "tilt", "sliding", "awning"]}, "anchor_ref": {"$ref": "#/$defs/anchor_ref"}}}}}},
    "opening": {"type": "object", "required": ["id", "wall_id", "t", "kind", "width_m", "height_m", "sill_m", "swing", "hinge", "confidence", "source"], "properties": {"id": {"$ref": "#/$defs/id"}, "wall_id": {"type": "string"}, "t": {"$ref": "#/$defs/unit"}, "kind": {"enum": ["door", "window", "passage"]}, "width_m": {"type": "number", "exclusiveMinimum": 0, "maximum": 10}, "height_m": {"type": "number", "exclusiveMinimum": 0, "maximum": 10}, "sill_m": {"type": "number", "minimum": 0, "maximum": 10}, "swing": {"enum": ["left", "right", "double", "sliding", "none"]}, "hinge": {"enum": ["start", "end"]}, "anchor_ref": {"$ref": "#/$defs/anchor_ref"}, "confidence": {"$ref": "#/$defs/unit"}, "source": {"$ref": "#/$defs/source"}, "external_ids": {"$ref": "#/$defs/external_ids"}, "material_id": {"$ref": "#/$defs/material_id"}, "tint": {"enum": ["clear", "tinted", "frosted", "reflective"], "description": "Document 2.2: a window's glass (absent = clear)."}}},
    "room": {"type": "object", "required": ["id"], "properties": {"id": {"$ref": "#/$defs/id"}, "level_id": {"type": ["string", "null"]}, "ceiling_height_m": {"type": ["number", "null"]}, "external_ids": {"$ref": "#/$defs/external_ids"}, "tags": {"$ref": "#/$defs/tags"}, "floor_material_id": {"$ref": "#/$defs/material_id"}, "ceiling_material_id": {"$ref": "#/$defs/material_id"}, "ceiling": {"type": "boolean", "description": "Document 2.2: false = no ceiling (a hall with a visible roof, an outdoor room); absent = true."}}},
    "label": {"type": "object", "required": ["id", "text", "position", "level_id", "size"], "properties": {"id": {"$ref": "#/$defs/id"}, "text": {"type": "string", "minLength": 1, "maxLength": 80}, "position": {"$ref": "#/$defs/point"}, "level_id": {"type": "string"}, "size": {"type": "number", "minimum": 6, "maximum": 200}, "shared_space_id": {"type": "string", "minLength": 1, "maxLength": 64, "description": "CR-009: explicit content of the shared space whose home zone this is - needed for an item outside the home outline (under the upper level only); never inferred from geometry."}}},
    "object": {"type": "object", "required": ["id", "item_id", "level_id", "position", "rotation_deg", "size", "z_m", "params", "confidence", "source"], "properties": {"id": {"$ref": "#/$defs/id"}, "item_id": {"type": "string", "minLength": 1, "maxLength": 64}, "level_id": {"type": "string"}, "position": {"$ref": "#/$defs/point"}, "rotation_deg": {"type": "number"}, "size": {"$ref": "#/$defs/size"}, "z_m": {"type": "number", "minimum": -50, "maximum": 500}, "params": {"type": "object"}, "label": {"type": ["string", "null"], "maxLength": 80}, "anchor_ref": {"$ref": "#/$defs/anchor_ref"}, "group_id": {"type": ["string", "null"]}, "confidence": {"$ref": "#/$defs/unit"}, "source": {"$ref": "#/$defs/source"}, "locked": {"type": "boolean"}, "external_ids": {"$ref": "#/$defs/external_ids"}, "tags": {"$ref": "#/$defs/tags"}, "shared_space_id": {"type": "string", "minLength": 1, "maxLength": 64, "description": "CR-009: explicit content of the shared space whose home zone this is - needed for an item outside the home outline (under the upper level only); never inferred from geometry."}, "material_id": {"$ref": "#/$defs/material_id"}, "light": {"$ref": "#/$defs/light"}}},
    "group": {"type": "object", "required": ["id", "kind", "member_ids"], "properties": {"id": {"$ref": "#/$defs/id"}, "kind": {"enum": ["array", "manual"]}, "member_ids": {"type": "array", "maxItems": 5000, "items": {"type": "string"}}, "params": {"type": "object"}, "label": {"type": ["string", "null"], "maxLength": 80}}},
    "connector": {"type": "object", "required": ["id", "kind", "level_from", "floor_ids", "polyline", "width_m", "source"], "properties": {"id": {"$ref": "#/$defs/id"}, "kind": {"enum": ["stairs", "ramp", "tribune", "elevator", "ladder"]}, "level_from": {"type": "string"}, "level_to": {"type": ["string", "null"]}, "floor_ids": {"type": "array", "items": {"type": "string"}}, "polyline": {"type": "array", "minItems": 2, "items": {"$ref": "#/$defs/point"}}, "width_m": {"type": "number", "minimum": 0.05, "maximum": 100}, "label": {"type": ["string", "null"], "maxLength": 80}, "object_id": {"type": ["string", "null"]}, "source": {"$ref": "#/$defs/source"}, "external_ids": {"$ref": "#/$defs/external_ids"}, "shape": {"enum": ["straight", "l", "u", null]}, "turn": {"enum": ["left", "right", "none", null]}, "flights": {"type": ["array", "null"], "minItems": 1, "maxItems": 2, "items": {"type": "object", "required": ["steps"], "properties": {"steps": {"type": "integer", "minimum": 1, "maximum": 60}}}}, "landing_depth_m": {"type": ["number", "null"], "minimum": 0.3, "maximum": 10}, "far": {"type": ["object", "null"], "description": "Read-only, computed by the server on every read of a connector to another floor and never stored: that floor's name (a neutral name for a reader who may not read it), the name and elevation of the level it reaches there, that floor's datum above this one in metres (the floor heights between) and whether it is above or below.", "properties": {"floor_id": {"type": "string"}, "floor_name": {"type": ["string", "null"]}, "level_name": {"type": ["string", "null"]}, "direction": {"enum": ["up", "down", null]}, "level_elevation_m": {"type": ["number", "null"]}, "datum_m": {"type": ["number", "null"]}, "missing": {"type": "boolean"}}}, "check_placement": {"type": "boolean", "description": "Set when the stairs model synced from the other floor regenerated this twin's path: the editor asks to check its place until it is moved or confirmed."}, "origin_floor_id": {"type": "string", "description": "The floor a cross-floor link was made from; only that floor moves the link to another floor."}, "needs_placement": {"type": "boolean"}, "shared_space_id": {"type": "string", "minLength": 1, "maxLength": 64, "description": "CR-009: explicit content of the shared space whose home zone this is - needed for an item outside the home outline (under the upper level only); never inferred from geometry."}}},
    "circuit": {"type": "object", "required": ["id", "name", "switch_entity_id", "member_ids", "color_token"], "properties": {"id": {"$ref": "#/$defs/id"}, "name": {"type": "string", "minLength": 1, "maxLength": 80}, "switch_entity_id": {"type": "string", "pattern": "^(switch|light)\\.[a-z0-9_]+$"}, "member_ids": {"type": "array", "items": {"type": "string"}}, "color_token": {"type": "string", "maxLength": 40}, "power_w": {"type": "number", "minimum": 0}}},
    "item": {"type": "object", "required": ["id"], "properties": {"id": {"$ref": "#/$defs/id"}}},
    "material_id": {"type": "string", "minLength": 1, "maxLength": 64, "pattern": "^[A-Za-z0-9][A-Za-z0-9_.:-]{0,63}$", "description": "Document 2.2: an id of the material library (smplwise/catalog/materials.json; the CR-029 spellings floor_oak etc. are aliases, stored as the id). An unknown id is a warning and draws the default, never an error; an unknown id outside the plain-id pattern is dropped on save (security review 2.4.7 I4)."},
    "light": {"type": "object", "required": ["kind", "color_k", "lumens"], "description": "Document 2.2: a lamp's emission (absent = the catalog item's light, else 3000 K / 800 lm ceiling).", "properties": {"kind": {"enum": ["ceiling", "wall", "spot", "strip", "floor", "pendant"]}, "color_k": {"type": "number", "minimum": 1800, "maximum": 6500}, "lumens": {"type": "number", "minimum": 1, "maximum": 20000}, "beam_deg": {"type": "number", "minimum": 1, "maximum": 180}}},
    "walk_position": {"type": "object", "additionalProperties": false, "required": ["id", "name", "x", "y", "level_id", "heading_deg"], "description": "security review 2.4.7 I1 / I4: no other key, the name bounded as written (not only trimmed), the id in the plain-id pattern - a save that breaks one is refused.", "properties": {"id": {"type": "string", "minLength": 1, "maxLength": 64, "pattern": "^[A-Za-z0-9][A-Za-z0-9_.:-]{0,63}$"}, "name": {"type": "string", "minLength": 1, "maxLength": 40}, "x": {"$ref": "#/$defs/unit"}, "y": {"$ref": "#/$defs/unit"}, "level_id": {"type": "string"}, "heading_deg": {"type": "number", "minimum": 0, "exclusiveMaximum": 360, "description": "the view bearing, clockwise from plan up"}, "is_default": {"type": "boolean"}}}
  }
}
