{
  "schema_version": "2.2",
  "plan_version_id": "sample-v22",
  "floor_id": "sample-floor",
  "source": {"sha256": "0000000000000000000000000000000000000000000000000000000000000000", "file_name": "sample.pdf", "mime": "application/pdf", "page": 1},
  "dimensions": {"width_px": 1000, "height_px": 800, "scale_m_per_px": 0.01, "calibration": {"status": "measured", "method": "two_point", "pairs": [{"a": [0.1, 0.1], "b": [0.9, 0.1], "metres": 8.0}], "residual_pct": 0.0, "reason": null}},
  "transform": {"rotation": 0, "crop": null},
  "levels": [
    {"id": "L0", "name": "מפלס ראשי", "elevation_m": 0.0, "ceiling_height_m": 3.0, "is_default": true, "external_ids": {}, "ceiling_material_id": "plaster_ceiling"},
    {"id": "L1", "name": "אולם תחתון", "elevation_m": -1.2, "ceiling_height_m": 6.0, "is_default": false, "external_ids": {}, "floor_material_id": "floor_sport"}
  ],
  "walls": [
    {"id": "wc", "level_id": "L0", "polyline": [[0.6, 0.1], [0.6, 0.5]], "thickness_m": 0.1, "height_m": 2.4, "base_z_m": 0, "kind": "partition", "confidence": 0.8, "source": "auto", "locked": false, "external_ids": {}, "material_id": "no_such_material"},
    {"id": "wa", "level_id": "L0", "polyline": [[0.1, 0.1], [0.9, 0.1], [0.9, 0.6]], "thickness_m": 0.3, "height_m": null, "base_z_m": 0, "kind": "exterior", "confidence": 1, "source": "manual", "locked": false, "external_ids": {}},
    {"id": "wd", "level_id": "L1", "polyline": [[0.1, 0.7], [0.4, 0.7]], "thickness_m": 0.2, "height_m": null, "base_z_m": 0, "kind": "interior", "confidence": 1, "source": "manual", "locked": false, "external_ids": {}},
    {"id": "wb", "level_id": "L0", "polyline": [[0.1, 0.5], [0.6, 0.5]], "thickness_m": 0.15, "height_m": null, "base_z_m": 0, "kind": "interior", "confidence": 1, "source": "manual", "locked": false, "external_ids": {}, "material_id": "brick_painted"}
  ],
  "openings": [
    {"id": "oe", "wall_id": "wb", "t": 0.9, "kind": "passage", "width_m": 1.0, "height_m": 2.1, "sill_m": 0, "swing": "none", "hinge": "start", "anchor_ref": null, "confidence": 1, "source": "manual", "external_ids": {}},
    {"id": "ob", "wall_id": "wa", "t": 0.75, "kind": "window", "width_m": 1.2, "height_m": 1.2, "sill_m": 0.9, "swing": "none", "hinge": "start", "anchor_ref": null, "confidence": 1, "source": "manual", "external_ids": {}, "tint": "frosted"},
    {"id": "of", "wall_id": "wd", "t": 0.5, "kind": "door", "width_m": 1.0, "height_m": 2.1, "sill_m": 0, "swing": "sliding", "hinge": "start", "anchor_ref": null, "confidence": 1, "source": "manual", "external_ids": {}},
    {"id": "oa", "wall_id": "wa", "t": 0.2, "kind": "door", "width_m": 0.9, "height_m": 2.1, "sill_m": 0, "swing": "right", "hinge": "start", "anchor_ref": null, "confidence": 1, "source": "manual", "external_ids": {}, "material_id": "door_metal"},
    {"id": "od", "wall_id": "wc", "t": 0.5, "kind": "door", "width_m": 1.6, "height_m": 2.1, "sill_m": 0, "swing": "double", "hinge": "start", "anchor_ref": null, "confidence": 1, "source": "manual", "external_ids": {}},
    {"id": "oc", "wall_id": "wb", "t": 0.5, "kind": "door", "width_m": 0.8, "height_m": 2.1, "sill_m": 0, "swing": "left", "hinge": "end", "anchor_ref": {"resource_type": "ha_entity", "resource_id": "lock.store"}, "confidence": 1, "source": "manual", "external_ids": {}}
  ],
  "rooms": [
    {"id": "r-hall", "level_id": "L1", "ceiling_height_m": 6.0, "ceiling": false},
    {"id": "r-office", "level_id": "L0", "tags": ["משרד"]},
    {"id": "r-store", "level_id": "L0", "floor_material_id": "tiles_grey", "ceiling_material_id": "plaster_white"},
    {"id": "r-wc", "level_id": null, "tags": ["Bathroom"]}
  ],
  "objects": [
    {"id": "o1", "item_id": "chair.basic", "level_id": "L0", "position": [0.2, 0.2], "rotation_deg": 0, "size": {"w_m": 0.45, "d_m": 0.45, "h_m": 0.85}, "z_m": 0, "params": {}, "label": null, "anchor_ref": null, "group_id": "g1", "confidence": 1, "source": "manual", "locked": false, "external_ids": {}, "material_id": "leather"},
    {"id": "o2", "item_id": "table.desk", "level_id": "L0", "position": [0.3, 0.4], "rotation_deg": 90, "size": {"w_m": 1.4, "d_m": 0.7, "h_m": 0.75}, "z_m": 0, "params": {}, "label": "שולחן", "anchor_ref": null, "group_id": "g1", "confidence": 1, "source": "manual", "locked": false, "external_ids": {}},
    {"id": "o3", "item_id": "light.ceiling", "level_id": "L0", "position": [0.5, 0.3], "rotation_deg": 0, "size": {"w_m": 0.4, "d_m": 0.4, "h_m": 0.1}, "z_m": 2.7, "params": {}, "label": null, "anchor_ref": {"resource_type": "ha_entity", "resource_id": "light.store"}, "group_id": null, "confidence": 1, "source": "manual", "locked": false, "external_ids": {}, "light": {"kind": "pendant", "color_k": 2700, "lumens": 950}},
    {"id": "o4", "item_id": "tribune.stepped", "level_id": "L0", "position": [0.25, 0.6], "rotation_deg": 180, "size": {"w_m": 4, "d_m": 3, "h_m": 1.2}, "z_m": 0, "params": {"rows": 4, "step_height_m": 0.3, "step_width_m": 1.0, "connects_levels": "L1"}, "label": null, "anchor_ref": null, "group_id": null, "confidence": 1, "source": "manual", "locked": false, "external_ids": {}},
    {"id": "o5", "item_id": "extinguisher.co2", "level_id": "L1", "position": [0.15, 0.8], "rotation_deg": 0, "size": {"w_m": 0.2, "d_m": 0.2, "h_m": 0.6}, "z_m": 0.9, "params": {}, "label": "מטף", "anchor_ref": null, "group_id": null, "confidence": 1, "source": "manual", "locked": false, "external_ids": {}}
  ],
  "circuits": [
    {"id": "k1", "name": "מעגל אולם", "switch_entity_id": "switch.hall_a", "member_ids": ["o3"], "color_token": "circuit-1", "power_w": 36}
  ],
  "connectors": [
    {"id": "c1", "kind": "stairs", "level_from": "L0", "level_to": "L1", "floor_ids": [], "polyline": [[0.7, 0.7], [0.8, 0.7]], "width_m": 1.2, "label": null, "object_id": null, "source": "manual", "external_ids": {}},
    {"id": "cx-o4", "kind": "tribune", "level_from": "L0", "level_to": "L1", "floor_ids": [], "polyline": [[0.25, 0.4125], [0.25, 0.7875]], "width_m": 4.0, "label": null, "object_id": "o4", "source": "auto", "external_ids": {}}
  ],
  "labels": [
    {"id": "lb", "text": "אולם", "position": [0.25, 0.75], "level_id": "L1", "size": 16},
    {"id": "la", "text": "מחסן", "position": [0.3, 0.3], "level_id": "L0", "size": 16}
  ],
  "groups": [
    {"id": "g1", "kind": "manual", "member_ids": ["o1", "o2"], "params": {}, "label": null}
  ],
  "uncertain_regions": [],
  "uncertainty": {"overall": 0.2, "notes": []},
  "meta": {"generator": "fixture", "tokens_version": "map-1", "detector_version": null},
  "north_deg": 23.5,
  "walk_positions": [
    {"id": "wp-entry", "name": "כניסה", "x": 0.2, "y": 0.15, "level_id": "L0", "heading_deg": 180.0, "is_default": true},
    {"id": "wp-hall", "name": "אולם", "x": 0.25, "y": 0.8, "level_id": "L1", "heading_deg": 90.0}
  ]
}
