{
  "schema_version": "2.1",
  "plan_version_id": "sample-curved",
  "floor_id": "sample-floor",
  "source": {
    "sha256": "0000000000000000000000000000000000000000000000000000000000000000",
    "file_name": "sample.pdf",
    "mime": "application/pdf",
    "page": 1
  },
  "dimensions": {
    "width_px": 1000,
    "height_px": 800,
    "scale_m_per_px": 0.01,
    "calibration": {
      "status": "measured",
      "method": "two_point",
      "pairs": [
        {
          "a": [
            0.1,
            0.1
          ],
          "b": [
            0.9,
            0.1
          ],
          "metres": 8.0
        }
      ],
      "residual_pct": 0.0,
      "reason": null
    }
  },
  "transform": {
    "rotation": 0,
    "crop": null
  },
  "levels": [
    {
      "id": "L0",
      "name": "מפלס ראשי",
      "elevation_m": 0.0,
      "ceiling_height_m": 3.0,
      "is_default": true,
      "external_ids": {}
    }
  ],
  "uncertainty": {
    "overall": 0.2,
    "notes": []
  },
  "meta": {
    "generator": "fixture",
    "tokens_version": "map-1",
    "detector_version": null
  },
  "walls": [
    {
      "id": "ca-arc",
      "level_id": "L0",
      "polyline": [
        [
          0.2,
          0.3
        ],
        [
          0.5,
          0.3
        ]
      ],
      "thickness_m": 0.25,
      "height_m": null,
      "base_z_m": 0,
      "kind": "exterior",
      "confidence": 1,
      "source": "manual",
      "locked": false,
      "external_ids": {},
      "bulges": [
        0.5
      ]
    },
    {
      "id": "cb-round",
      "level_id": "L0",
      "polyline": [
        [
          0.7,
          0.5
        ],
        [
          0.9,
          0.5
        ],
        [
          0.7,
          0.5
        ]
      ],
      "thickness_m": 0.2,
      "height_m": null,
      "base_z_m": 0,
      "kind": "interior",
      "confidence": 1,
      "source": "manual",
      "locked": false,
      "external_ids": {},
      "bulges": [
        1.0,
        1.0
      ]
    },
    {
      "id": "cc-mixed",
      "level_id": "L0",
      "polyline": [
        [
          0.1,
          0.6
        ],
        [
          0.3,
          0.6
        ],
        [
          0.3,
          0.9
        ]
      ],
      "thickness_m": 0.15,
      "height_m": null,
      "base_z_m": 0,
      "kind": "partition",
      "confidence": 1,
      "source": "manual",
      "locked": false,
      "external_ids": {},
      "bulges": [
        0.0,
        -0.414214
      ]
    },
    {
      "id": "cd-room",
      "level_id": "L0",
      "polyline": [
        [
          0.45,
          0.55
        ],
        [
          0.6,
          0.55
        ],
        [
          0.6,
          0.7
        ],
        [
          0.45,
          0.7
        ],
        [
          0.45,
          0.55
        ]
      ],
      "thickness_m": 0.1,
      "height_m": null,
      "base_z_m": 0,
      "kind": "interior",
      "confidence": 1,
      "source": "manual",
      "locked": false,
      "external_ids": {}
    },
    {
      "id": "ce-straight",
      "level_id": "L0",
      "polyline": [
        [
          0.05,
          0.1
        ],
        [
          0.4,
          0.1
        ]
      ],
      "thickness_m": 0.2,
      "height_m": null,
      "base_z_m": 0,
      "kind": "interior",
      "confidence": 1,
      "source": "manual",
      "locked": false,
      "external_ids": {}
    }
  ],
  "openings": [
    {
      "id": "oa-door",
      "wall_id": "ca-arc",
      "t": 0.5,
      "kind": "door",
      "width_m": 0.9,
      "height_m": 2.1,
      "sill_m": 0,
      "swing": "left",
      "hinge": "start",
      "anchor_ref": null,
      "confidence": 1,
      "source": "manual",
      "external_ids": {}
    },
    {
      "id": "ob-window",
      "wall_id": "cb-round",
      "t": 0.25,
      "kind": "window",
      "width_m": 1.2,
      "height_m": 1.2,
      "sill_m": 0.9,
      "swing": "none",
      "hinge": "start",
      "anchor_ref": null,
      "confidence": 1,
      "source": "manual",
      "external_ids": {}
    },
    {
      "id": "oc-pass",
      "wall_id": "cc-mixed",
      "t": 0.8,
      "kind": "passage",
      "width_m": 0.8,
      "height_m": 2.1,
      "sill_m": 0,
      "swing": "none",
      "hinge": "start",
      "anchor_ref": null,
      "confidence": 1,
      "source": "manual",
      "external_ids": {}
    }
  ],
  "rooms": [],
  "objects": [],
  "circuits": [],
  "connectors": [],
  "labels": [],
  "groups": [],
  "uncertain_regions": []
}
